<?xml version="1.0" encoding="UTF-8"?>
<TOTVSIntegrator xmlns:xsi="http://www.w3.org/2001/XMLSchema-instance" xsi:noNamespaceSchemaLocation="mpschemas.xsd">
  <GlobalProduct>GlobalProduct</GlobalProduct>
  <GlobalFunctionCode>GlobalFunctionCode</GlobalFunctionCode>
  <GlobalDocumentFunctionCode>GlobalDocumentFunctionCode</GlobalDocumentFunctionCode>
  <GlobalDocumentFunctionDescription>GlobalDocumentFunctionDescription</GlobalDocumentFunctionDescription>
  <DocVersion>DocVersion</DocVersion>
  <DocDateTime>DocDateTime</DocDateTime>
  <DocIdentifier>DocIdentifier</DocIdentifier>
  <DocCompany>DocCompany</DocCompany>
  <DocBranch>DocBranch</DocBranch>
  <DocName>DocName</DocName>
  <DocFederalID>DocFederalID</DocFederalID>
  <DocType>DocType</DocType>
  <Message>
    <Layouts>
      <Version>Version</Version>
      <Identifier>Identifier</Identifier>
      <FunctionCode>FunctionCode</FunctionCode>
      <Content>
        <MATA030/>
      </Content>
    </Layouts>
  </Message>
</TOTVSIntegrator>
